{
  "name": "peninsula_loop",
  "description": "A coastal loop around a peninsula with one tempting but expensive spur.",
  "grid_size": 19,
  "max_battery": 20,
  "starting_battery": 20,
  "layout": [
    "WWWWWWWWWWWWWWWWWWW",
    "WWWWWWWWWWWWWWWWWWW",
    "WWHRRRRPRRRRRRSRRWW",
    "WWRWWWWWPWWWWWWWRWW",
    "WWRWWWWWRWWWWWWWRWW",
    "WWRWWWWWRWWWWWWWRWW",
    "WWRWWWWWRRRRRWWWRWW",
    "WWRWWWWWWWRWRWWWPWW",
    "WWSWWWWWWWRRRWWWRWW",
    "WWRWWWWWWWWWWWWWRWW",
    "WWRWWWWWWWWWWWWWRWW",
    "WWRWWWWWWWWWWWWWRWW",
    "WWRWWWWWWWWWWWWWRWW",
    "WWRWWWWWWWWWWWWWRWW",
    "WWRWWWWWWWWWWWWWRWW",
    "WWRRRRPRRRRRRSRRRWW",
    "WWWWWWWWWWWWWWWWWWW",
    "WWWWWWWWWWWWWWWWWWW",
    "WWWWWWWWWWWWWWWWWWW"
  ],
  "legend": {
    "B": "building",
    "H": "home",
    "P": "park",
    "R": "road",
    "S": "supercharger",
    "W": "water"
  }
}
