{
  "name": "Local 50x50 Labyrinth",
  "description": "A local 50x50 stress-test map with a long serpentine road and sparse charging.",
  "grid_size": 50,
  "max_battery": 50,
  "starting_battery": 50,
  "layout": [
    "BBBBBBBBBBBBBBBBBBBBBBBBBBBBBBBBBBBBBBBBBBBBBBBBBB",
    "BHRRRRRRRRRPRRRRRRRRRSRRRRRRRRRRRRRRRRRRRSRRRRRRRB",
    "BBBBBBBBBBBBBBBBBBBBBBBBBBBBBBBBBBBBBBBBBBBBBBBBRB",
    "BRRRRRRRRRRRSRRRRPRRRRRRRRRRRRRRSRRRRRRRRRRRRRRRRB",
    "BRBBBBBBBBBBBBBBBBBBBBBBBBBBBBBBBBBBBBBBBBBBBBBBBB",
    "BRRSRRRRRRRRRRRRRRRRRRRPRRRRRRRRRRRRRRRRRRRSRRRRRB",
    "BBBBBBBBBBBBBBBBBBBBBBBBBBBBBBBBBBBBBBBBBBBBBBBBRB",
    "BRRRRRRRRRRRRRSRRRRRRRRRRRRRRPRRRRSRRRRRRRRRRRRRRB",
    "BRBBBBBBBBBBBBBBBBBBBBBBBBBBBBBBBBBBBBBBBBBBBBBBBB",
    "BRRRRSRRRRRRRRRRRRRRRRRRRSRRRRRRRRRPRRRRRRRRRSRRRB",
    "BBBBBBBBBBBBBBBBBBBBBBBBBBBBBBBBBBBBBBBBBBBBBBBBRB",
    "BRRRRRRRRRRRRRRRSRRRRRRRRRRRRRRRRRRRSRRRRPRRRRRRRB",
    "BRBBBBBBBBBBBBBBBBBBBBBBBBBBBBBBBBBBBBBBBBBBBBBBBB",
    "BRRRRRRSRRRRRRRRRRRRRRRRRRRSRRRRRRRRRRRRRRRRRRRPRB",
    "BBBBBBBBBBBBBBBBBBBBBBBBBBBBBBBBBBBBBBBBBBBBBBBBRB",
    "BRRRRRRRRRRRRRRRRRSRRRRRRRRRRRRRRRRRRRSRRRRRRRRRRB",
    "BRBBBBBBBBBBBBBBBBBBBBBBBBBBBBBBBBBBBBBBBBBBBBBBBB",
    "BRRRPRRRRSRRRRRRRRRRRRRRRRRRRSRRRRRRRRRRRRRRRRRRRB",
    "BBBBBBBBBBBBBBBBBBBBBBBBBBBBBBBBBBBBBBBBBBBBBBBBSB",
    "BRRRRRRRRRPRRRRRRRRRSRRRRRRRRRRRRRRRRRRRSRRRRRRRRB",
    "BRBBBBBBBBBBBBBBBBBBBBBBBBBBBBBBBBBBBBBBBBBBBBBBBB",
    "BRRRRRRRRRRSRRRRPRRRRRRRRRRRRRRSRRRRRRRRRRRRRRRRRB",
    "BBBBBBBBBBBBBBBBBBBBBBBBBBBBBBBBBBBBBBBBBBBBBBBBRB",
    "BRSRRRRRRRRRRRRRRRRRRRPRRRRRRRRRRRRRRRRRRRSRRRRRRB",
    "BRBBBBBBBBBBBBBBBBBBBBBBBBBBBBBBBBBBBBBBBBBBBBBBBB",
    "BRRRRRRRRRRRRSRRRRRRRRRRRRRRPRRRRSRRRRRRRRRRRRRRRB",
    "BBBBBBBBBBBBBBBBBBBBBBBBBBBBBBBBBBBBBBBBBBBBBBBBRB",
    "BRRRSRRRRRRRRRRRRRRRRRRRSRRRRRRRRRPRRRRRRRRRSRRRRB",
    "BRBBBBBBBBBBBBBBBBBBBBBBBBBBBBBBBBBBBBBBBBBBBBBBBB",
    "BRRRRRRRRRRRRRRSRRRRRRRRRRRRRRRRRRRSRRRRPRRRRRRRRB",
    "BBBBBBBBBBBBBBBBBBBBBBBBBBBBBBBBBBBBBBBBBBBBBBBBRB",
    "BRRRRRSRRRRRRRRRRRRRRRRRRRSRRRRRRRRRRRRRRRRRRRPRRB",
    "BRBBBBBBBBBBBBBBBBBBBBBBBBBBBBBBBBBBBBBBBBBBBBBBBB",
    "BRRRRRRRRRRRRRRRRSRRRRRRRRRRRRRRRRRRRSRRRRRRRRRRRB",
    "BBBBBBBBBBBBBBBBBBBBBBBBBBBBBBBBBBBBBBBBBBBBBBBBRB",
    "BRRPRRRRSRRRRRRRRRRRRRRRRRRRSRRRRRRRRRRRRRRRRRRRSB",
    "BRBBBBBBBBBBBBBBBBBBBBBBBBBBBBBBBBBBBBBBBBBBBBBBBB",
    "BRRRRRRRRPRRRRRRRRRSRRRRRRRRRRRRRRRRRRRSRRRRRRRRRB",
    "BBBBBBBBBBBBBBBBBBBBBBBBBBBBBBBBBBBBBBBBBBBBBBBBRB",
    "BRRRRRRRRRSRRRRPRRRRRRRRRRRRRRSRRRRRRRRRRRRRRRRRRB",
    "BRBBBBBBBBBBBBBBBBBBBBBBBBBBBBBBBBBBBBBBBBBBBBBBBB",
    "BSRRRRRRRRRRRRRRRRRRRPRRRRRRRRRRRRRRRRRRRSRRRRRRRB",
    "BBBBBBBBBBBBBBBBBBBBBBBBBBBBBBBBBBBBBBBBBBBBBBBBRB",
    "BRRRRRRRRRRRSRRRRRRRRRRRRRRPRRRRSRRRRRRRRRRRRRRRRB",
    "BRBBBBBBBBBBBBBBBBBBBBBBBBBBBBBBBBBBBBBBBBBBBBBBBB",
    "BRRSRRRRRRRRRRRRRRRRRRRSRRRRRRRRRPRRRRRRRRRSRRRRRB",
    "BBBBBBBBBBBBBBBBBBBBBBBBBBBBBBBBBBBBBBBBBBBBBBBBRB",
    "BRRRRRRRRRRRRRSRRRRRPRRRRRRRRRRRRRSRRRRPSRRRRRRRPB",
    "BRBBBBBBBBBBBBBBBBBBBBBBBBBBBBBBBBBBBBBBBBBBBBBBBB",
    "BBBBBBBBBBBBBBBBBBBBBBBBBBBBBBBBBBBBBBBBBBBBBBBBBB"
  ],
  "legend": {
    "B": "building",
    "H": "home",
    "P": "park",
    "R": "road",
    "S": "supercharger",
    "W": "water"
  }
}
