{
  "name": "Switchback Ridge",
  "description": "A steep switchback route where every turn costs time and battery.",
  "grid_size": 18,
  "max_battery": 20,
  "starting_battery": 20,
  "layout": [
    "BBBBBBBBBBBBBBBBBB",
    "BHRRRRBBBBBBBBBBBB",
    "BRPRRRBBBBBBBBBBBB",
    "BRRRRSBBBBBBBBBBBB",
    "BRRRRRBBBBBBBBBBBB",
    "BRRPRRBBBBBBBBBBBB",
    "BRRRRRBBBBBBBBBBBB",
    "BSRRRRBBBBBBBBBBBB",
    "BRRRPRBBBBBBBBBBBB",
    "BRRRRSBBBBBBBBBBBB",
    "BRRRRRBBBBBBBBBBBB",
    "BPRRRRBBBBBBBBBBBB",
    "BRRRRRBBBBBBBBBBBB",
    "BRRRRRBBBBBBBBBBBB",
    "BRRRRRBBBBBBBBBBBB",
    "BRRRRRBBBBBBBBBBBB",
    "BBBBBBBBBBBBBBBBBB",
    "BBBBBBBBBBBBBBBBBB"
  ],
  "legend": {
    "B": "building",
    "H": "home",
    "P": "park",
    "R": "road",
    "S": "supercharger",
    "W": "water"
  }
}
