{
  "name": "everglades_fork",
  "description": "Marshland spine with branching park detours that punish greedy routing.",
  "grid_size": 18,
  "max_battery": 20,
  "starting_battery": 20,
  "layout": [
    "WWWWWWWWWWWWWWWWWW",
    "WWWWHWWWWWWWWWWWWW",
    "WWWWRWWWWWWWWWWWWW",
    "WWWWPRRRSRWWWWWWWW",
    "WWWWRWWWWWWWWWWWWW",
    "WWWWPWWWWWWWWWWWWW",
    "WWWWRWWWWWWWWWWWWW",
    "WWWWRRRPRRRSWWWWWW",
    "WWWWRWWWWWWWWWWWWW",
    "WWWWSWWWWWWWWWWWWW",
    "WWWWRWWWWWWWWWWWWW",
    "WWWWRRRPRRRWWWWWWW",
    "WWWWRWWWWWWWWWWWWW",
    "WWWWRWWWWWWWWWWWWW",
    "WWWWRRRRRRRRWWWWWW",
    "WWWWRWWWWWWWWWWWWW",
    "WWWWRWWWWWWWWWWWWW",
    "WWWWWWWWWWWWWWWWWW"
  ],
  "legend": {
    "B": "building",
    "H": "home",
    "P": "park",
    "R": "road",
    "S": "supercharger",
    "W": "water"
  }
}
