{
  "name": "Medium Island",
  "description": "Medium difficulty - Navigate between islands connected by bridges",
  "grid_size": 14,
  "max_battery": 20,
  "starting_battery": 20,
  "layout": [
    "BBBBBBBBBBBBBB",
    "BPRRRRRRRRRRPB",
    "BRRBBBRRBBBRBB",
    "BRRBBRRRRBBRRB",
    "BRSBPRRRRPBSRB",
    "BBBBBRRRRBBBRB",
    "BWWWWRRRRWWWWB",
    "BWWWWRHHRWWWWB",
    "BWWWWRRRRWWWWB",
    "BBBBRRRRRBBBRB",
    "BRRBSRRRRSBRBB",
    "BRRBBRRRRBBRRB",
    "BRRBBBRRBBBRBB",
    "BBBBBBBBBBBBBB"
  ],
  "legend": {
    "B": "building",
    "H": "home",
    "P": "park",
    "R": "road",
    "S": "supercharger",
    "W": "water"
  }
}
