{
  "name": "Highway Cruise",
  "description": "Easy mode with a highway loop and convenient charging stations",
  "grid_size": 12,
  "max_battery": 18,
  "starting_battery": 18,
  "layout": [
    "BBBBBBBBBBBB",
    "BPRRRRRRRRSB",
    "BRRRRRRRRRRB",
    "BRRRRRRRRRRB",
    "BRRRHHHHRRRB",
    "BRRRHHHHRRRB",
    "BRRRHHHHRRRB",
    "BRRRRRRRRRRB",
    "BRRRRRRRRRRB",
    "BSRRRRRRRPRB",
    "BRRRRRRRRRRB",
    "BBBBBBBBBBBB"
  ],
  "legend": {
    "R": "road",
    "H": "home",
    "P": "park",
    "S": "supercharger",
    "W": "water",
    "B": "building"
  }
}
