{
  "name": "Caldera Circuit",
  "description": "Race the ring road around an active volcanic caldera on Stella Island. The lava lake in the center is impassable \u2014 navigate the coastal circuit to visit all 10 scenic overlooks before your battery dies.",
  "grid_size": 16,
  "max_battery": 25,
  "starting_battery": 25,
  "layout": [
    "WWWWWWWWWWWWWWWW",
    "WWWWWWWWWWWWWWWW",
    "WWWWWWWWWWWWWWWW",
    "WWWPRPRHRRPRPWWW",
    "WWWRBBBBBBBBRWWW",
    "WWWPBBBBBBBBPWWW",
    "WWWRBBWWWWBBRWWW",
    "WWWHBBWWWWBBSWWW",
    "WWWRBBWWWWBBRWWW",
    "WWWPBBWWWWBBPWWW",
    "WWWRBBBBBBBBRWWW",
    "WWWRBBBBBBBBRWWW",
    "WWWPRRRHRRPRRWWW",
    "WWWWWWWWWWWWWWWW",
    "WWWWWWWWWWWWWWWW",
    "WWWWWWWWWWWWWWWW"
  ],
  "legend": {
    "R": "road",
    "H": "home",
    "P": "park",
    "S": "supercharger",
    "W": "water",
    "B": "building"
  }
}
