{
  "name": "wwww",
  "description": "A city block with parks, water feature, and a supercharger hub",
  "grid_size": 10,
  "max_battery": 20,
  "starting_battery": 15,
  "layout": [
    "RRRBBBRRRR",
    "RRRBRRRRRR",
    "RRHBRRRSRR",
    "RRRBBBRRRR",
    "RRRRRRRRRR",
    "RRWWWWRRRR",
    "RRWPRRPRRR",
    "RRWWWWPRRR",
    "RRRRRRRRRR",
    "RRRPRRRBBB"
  ],
  "legend": {
    "B": "building",
    "H": "home",
    "P": "park",
    "R": "road",
    "S": "supercharger",
    "W": "water"
  }
}
