{
  "name": "Downtown Grid",
  "description": "Medium difficulty - Navigate city blocks and one-way streets",
  "grid_size": 15,
  "max_battery": 22,
  "starting_battery": 22,
  "layout": [
    "BBBBBBBBBBBBBBB",
    "BPRRRRRRRRRRRSB",
    "BRBBBRBBBRBBBBB",
    "BRRRBPRBRPBRRBB",
    "BRBBBRBBBRBBBBB",
    "BRRRRRRRRRRRRBB",
    "BBBBBRRRRRBBBBB",
    "BSRRRHHHHHRRRPB",
    "BBBBBRRRRRBBBBB",
    "BRRRRRRRRRRRRBB",
    "BRBBBRBBBRBBBBB",
    "BRRPBRRBRRBRRBB",
    "BRBBBRBBBRBBBBB",
    "BSRRRRRRRRRPRBB",
    "BBBBBBBBBBBBBBB"
  ],
  "legend": {
    "R": "road",
    "H": "home",
    "P": "park",
    "S": "supercharger",
    "W": "water",
    "B": "building"
  }
}
