{
  "name": "Easy Mode - Trapped Park",
  "description": "Beginner-friendly layout with one challenging park surrounded by buildings",
  "grid_size": 10,
  "max_battery": 15,
  "starting_battery": 15,
  "layout": [
    "BBBBBBBBBB",
    "BRRRRSRRRB",
    "BRPRRRRPRB",
    "BRRRHHRRRB",
    "BSRHHHHRBB",
    "BRRHHHRRBB",
    "BRRRRRRBBB",
    "BRPRRRRBPB",
    "BRRRRSRRRB",
    "BBBBBBBBBB"
  ],
  "legend": {
    "R": "road",
    "H": "home",
    "P": "park",
    "S": "supercharger",
    "W": "water",
    "B": "building"
  }
}
