{
  "name": "Suburban Easy",
  "description": "Easy cruise through a suburban neighborhood with cul-de-sacs and parks",
  "grid_size": 11,
  "max_battery": 16,
  "starting_battery": 16,
  "layout": [
    "BBBBBBBBBBB",
    "BPRRRRRRRPB",
    "BRBBBBBBRBB",
    "BRRRRRRRRBB",
    "BBBRRRRRBRB",
    "BSRRRHRRRSB",
    "BBBRRRRRBRB",
    "BRRRRRRRRBB",
    "BRBBBBBBRBB",
    "BPRRRRRRRPB",
    "BBBBBBBBBBB"
  ],
  "legend": {
    "B": "building",
    "H": "home",
    "P": "park",
    "R": "road",
    "S": "supercharger",
    "W": "water"
  }
}
