{
  "name": "Garden Path Easy",
  "description": "Easy layout with abundant charging and close parks",
  "grid_size": 12,
  "max_battery": 15,
  "starting_battery": 15,
  "layout": [
    "BBBBBBBBBBBB",
    "BSRRRRRRRRPB",
    "BRBBBBBBBRBB",
    "BRPRRRRRSRRB",
    "BRRBBBBBBRBB",
    "BRRRRRHHHRPB",
    "BPRRRRHHHRRB",
    "BRRBBBBBBRBB",
    "BRRSRRRRRPRB",
    "BBRBBBBBBRBB",
    "BPRRRRRRRRPB",
    "BBBBBBBBBBBB"
  ],
  "legend": {
    "R": "road",
    "H": "home",
    "P": "park",
    "S": "supercharger",
    "W": "water",
    "B": "building"
  }
}
