{
  "name": "Classic Layout",
  "description": "The original Tesla Road Trip game layout",
  "grid_size": 15,
  "max_battery": 20,
  "starting_battery": 20,
  "layout": [
    "BBBWBBBPBBBWBBB",
    "BRRRRRRRRRRRRRB",
    "BRBBBRRSRBBBRPB",
    "BRBPBRRRRRBPBRB",
    "BRBRBBBRBBBRBBB",
    "BRRRRRRRRRRRRRB",
    "BBBBRWWWWWBBBBB",
    "PRRRRHHHHHRRRRP",
    "BBBBRWWWWWBBBBB",
    "BRRRRRRRRRRRRRB",
    "BRBRBBBRBBBRBBB",
    "BRBPBRRRRRBPBRB",
    "BRBBBRRSRBBBRPB",
    "BRRRRRRRRRRRRRB",
    "BBBWBBBPBBBWBBB"
  ],
  "legend": {
    "R": "road",
    "H": "home",
    "P": "park",
    "S": "supercharger",
    "W": "water",
    "B": "building"
  }
}
