{
  "name": "One Way City",
  "description": "One-way streets form a racetrack loop. Follow the arrows or get blocked.",
  "grid_size": 12,
  "max_battery": 25,
  "starting_battery": 25,
  "layout": [
    "BBBBBBBBBBBB",
    "BH>>>>>P>>7B",
    "BRBBBBBBBBvB",
    "BRBBBBBBBBvB",
    "BRBBBBBBBBvB",
    "BRBBBBBBBBvB",
    "BRBBBBBBBBvB",
    "BRBBBBBBBBvB",
    "BRBBBBBBBBvB",
    "BRBBBBBBBBvB",
    "BJ<<<<P<<<HB",
    "BBBBBBBBBBBB"
  ],
  "legend": {
    "B": "building",
    "H": "home",
    "P": "park",
    "R": "road",
    "S": "supercharger",
    "W": "water"
  },
  "cell_configs": {
    ">": {
      "type": "road",
      "allowed_directions": [
        "east"
      ]
    },
    "<": {
      "type": "road",
      "allowed_directions": [
        "west"
      ]
    },
    "v": {
      "type": "road",
      "allowed_directions": [
        "south"
      ]
    },
    "7": {
      "type": "road",
      "allowed_directions": [
        "east",
        "south"
      ]
    },
    "J": {
      "type": "road",
      "allowed_directions": [
        "west",
        "north"
      ]
    }
  }
}
