{
  "name": "harbor_hop",
  "description": "Harbor district with a central loop and four docks to visit in the right order.",
  "grid_size": 15,
  "max_battery": 18,
  "starting_battery": 18,
  "layout": [
    "BBBBBBBBBBBBBBB",
    "BBBBBBBRBBBBBBB",
    "BBBBBBBRBBBBBBB",
    "BBBHRPRRRSRRBBB",
    "BBBRBBBBBBBRBBB",
    "BBBRBBBBBBBPBBB",
    "BBBRBBBBBBBRBBB",
    "BRRRBBBBBBBRRRB",
    "BBBRBBBBBBBRBBB",
    "BBBPBBBBBBBSBBB",
    "BBBRBBBBBBBRBBB",
    "BBBRRSRRRPRRBBB",
    "BBBBBBBRBBBBBBB",
    "BBBBBBBRBBBBBBB",
    "BBBBBBBBBBBBBBB"
  ],
  "legend": {
    "B": "building",
    "H": "home",
    "P": "park",
    "R": "road",
    "S": "supercharger",
    "W": "water"
  }
}
